{
  "$schema": "https://json-schema.org/draft/2020-12/schema",
  "$id": "https://aijoylab.kr/schemas/evidence_contract.schema.json",
  "title": "JoyLab Evidence Contract V1",
  "type": "object",
  "additionalProperties": false,
  "required": [
    "contract_version",
    "agent_id",
    "run_id",
    "agent_contract_ref",
    "started_at",
    "completed_at",
    "outcome",
    "checks",
    "artifacts",
    "summary"
  ],
  "properties": {
    "contract_version": {
      "const": "1.0"
    },
    "agent_id": {
      "type": "string",
      "minLength": 1
    },
    "run_id": {
      "type": "string",
      "minLength": 1
    },
    "agent_contract_ref": {
      "type": "string",
      "minLength": 1
    },
    "started_at": {
      "type": "string",
      "format": "date-time"
    },
    "completed_at": {
      "type": "string",
      "format": "date-time"
    },
    "stage": {
      "type": [
        "string",
        "null"
      ]
    },
    "outcome": {
      "enum": [
        "PASS",
        "BLOCKED",
        "UNVERIFIED"
      ]
    },
    "command_exit_code": {
      "type": [
        "integer",
        "null"
      ]
    },
    "checks": {
      "type": "array",
      "minItems": 1,
      "items": {
        "type": "object",
        "additionalProperties": false,
        "required": [
          "id",
          "required",
          "status",
          "detail"
        ],
        "properties": {
          "id": {
            "type": "string",
            "minLength": 1
          },
          "required": {
            "type": "boolean"
          },
          "status": {
            "enum": [
              "PASS",
              "FAIL",
              "MISSING",
              "SKIPPED"
            ]
          },
          "detail": {
            "type": "string"
          }
        }
      }
    },
    "artifacts": {
      "type": "array",
      "items": {
        "type": "object",
        "additionalProperties": false,
        "required": [
          "path",
          "exists"
        ],
        "properties": {
          "path": {
            "type": "string",
            "minLength": 1
          },
          "exists": {
            "type": "boolean"
          },
          "size_bytes": {
            "type": [
              "integer",
              "null"
            ],
            "minimum": 0
          },
          "sha256": {
            "type": [
              "string",
              "null"
            ]
          }
        }
      }
    },
    "failure_packet": {
      "type": [
        "string",
        "null"
      ]
    },
    "summary": {
      "type": "string",
      "minLength": 1
    }
  }
}
